q1_title,q1_body,q1_id,q2_title,q2_body,q2_id,duplicate_labelMaterials on proper use of English tense,"
Possible Duplicate:
How do the tenses in English correspond temporally to one another? 

Could anyone suggest to me a good online source to help me with the concepts of English tense? I've tried searching with Google but haven't found anything. I'm looking for material which starts from the basics and gives a comprehensive review of the subject.
I am looking to learn about the correct usage of ""have,"" ""has,"" ""had,"" ""do,"" ""does,"" ""have been,"" ""had been,"" etc.
",16745,"Proper use of ""has been"" versus ""have been"" after plural reference","What is the actual ""rule,"" and which one is correct?

Ports 10-20 have been or has been opened.  

I strongly believe that ""have been"" is correct. I do not however remember the ""rule,"" so I cannot explain why it is correct.
Can anyone give me some foundation to build my case, please?
",59125,0
Preposition confusion,"
Possible Duplicates:
Rule for using “for” vs. “to”
When to use “to” and when “for”? 

To me the hardest thing in English is preposition and i make mistakes here. Fore example i confuse: ""it is difficult for me"" and ""it is difficult to me""
Is there any rule?
",16750,"Is ""freak-out"" an active or a passive experience?","The OED defines the verb freak-out as meaning:


to freak out (occas. without out): to undergo an intense emotional experience, to become stimulated, to rave, esp. under the influence of
  hallucinatory drugs. Also trans., to cause (a person) to be aroused or
  stimulated in such a way. (Also in more trivial uses.) So
  freaked-out adj. affected thus.  freaking-out n.


Examples of freak-out are given from 1965. They stop in 1970, suggesting that this was perhaps a word of the 60s, though I still hear it being used mostly by Americans, a lot during the recent election campaign.
Typically the OED's examples are in both an active and passive context. 

1970   It 27 Feb. 11/1   Aage leaps about and shouts at them and
  freaks them out.
1970   Nature 23 May 704/1   One question asked the respondents how
  often they had seen other people ‘freak out’, that is, have intense,
  transient emotional upsets.

The first of the above is a transitive verb, the second an active intransitive verb.
Sometimes people get freaked-out, sometimes they freak-out. In a newspaper article I have been reading on people who supported Donald Trump, a 25-year-old man, James Morrison says I was freaked out about Hillary because there were 33,000 emails....So, who or what did the freaking-out? Hillary is an indirect object governed by 'about'.
Now that does not sound quite the same sort of thing someone saying they freaked-out because of the 33,000 emails...
So how does the meaning change here between these two uses? Can anyone throw any light on the matter, please? 
Edit. After giving further thought to this and after a helpful dialogue of comments with others, which has better crystallised the issue in my mind, I feel I should re-pose the question. What concerns me is that freaking-out, it seems, can be both a self generated experience (he freaked out) or something that is inflicted upon one (it freaked him out). I cannot for the moment think of any other verbs which behave in quite this way. Can anyone else? 
",358592,0
"""I don't think that that can be done""","
Possible Duplicate:
How do you handle “that that”? The double “that” problem 

Is there something wrong with this sentence?

""I don't think that that can be done.""

It sounds odd to me. Would it be better if I'd use just one ""that"" instead of two: 

""I don't think that can be done.""

",16776,"Why does the word ""Catholic"" have two contrasting meanings?","catholic means including a wide variety of things; all-embracing.
and
Catholic means of the Roman Catholic faith.
But whenever I hear the someone say, ""I'm catholic"", it's hard for me to distinguish which usage are they referring to (even with the context). In writing, its easy to differentiate them by the lowercase/uppercase beginning.
My question, though, is what is the origin of the meaning of these two words? I get confused more because I associate the Catholicism with conservatism which is kinda the opposite of being catholic.
",468263,0
"Why do some ""ing"" verbs change tense to ""ung"" while others go to ""inged?""","
Possible Duplicate:
Origin of different past tenses for verbs with the same endings? 

Spring has sprung, the bell we had to ring was rung, the sting was stung but when I had to ping a computer it was pinged and the thing I had to bring was brought.
What is the difference between a word that shifts in the past tense from ""ing"" to ""ung"" and those that shift to ""inged"" or something else? Where does it come from? 
",16831,What does “there” mean in the last sentence?,"
Nakata silently stood up and came over to stand in front of Miss Saeki. He
laid his hard, sunburned hands on top of hers on the files. And as if listening
carefully to something, he felt the warmth there filter from her hand to his.

I don’t know what “there” word means grammatically and why “filter” verb is used without suffix -s? It looks like “The warmth filters from her hand to his”.
I hope you help!
",538980,0
"Difference between ""kinds of books"", ""kinds of book"", ""kind of books""","I want to know the difference between the usage of ""kinds of books"", ""kinds of book"", and ""kind of books"".
",16915,When was the Year 0?,"How does one know how many years before year 0000(current years) say ""300 BC"" was?
",566379,0
Authoritative source on the diaeresis trema rule,"
Possible Duplicate:
“Whereäs” as an alternative spelling of “whereas” 

I've got an impression that there is (or was) a rule in English: 
If you have a rarely used word with two vowel letters in a row, corresponding to two vowel sounds in a row (as opposed to a diphthong or single vowel sound marked by two letters), you have to mark a second vowel with a trema.
For example: coöperation.
As rarely used word gets more popular and recognizable, trema is dropped from the spelling. In contemporary English cooperation is spelled without it.
Is there an authoritative source on this rule?
I guess, any linguistics work would do, Wikipedia would not. Something that I can cite and not be laughed at.
",16959,What is the word to describe a bird organizing its feathers?,"Which verb most accurately and commonly describes a bird's daily behavior to make its feathers clean and organized.

""organize"" its feathers
""brush"" its feathers
""clean"" its feathers?

",474242,0
"""Should I"" or ""Shall I"" or …?","
Possible Duplicate:
“Should” vs. “Shall” vs. “Will” vs. “Must” 


Shall I upload the pictures?

I'm not sure how to start this sentence. If I offer someone to do something (like uploading pictures as in the example above, or closing the door), how do I say this?
",16983,How do you say when you let miss a letter in the middle of the word?,"Example: somone (as a misstype for 'someone')
Whey I write I say 'misstype', but if I talk missing a letter, how do I say?
(in my native language, portuguese, there's an expression 'to eat the letter', I don't know in English)
",266893,0
Recommendation for English Grammar books?,"
Possible Duplicate:
What are some of the better English reference grammars? 

I grew up in a non-English speaking country. During my elementary and middle school years, I self-studied the grammar of English via various books written by the most famous experts in my country, although these were beyond what were required by my curriculum. I am not saying my English is good enough now, but the study from the old days still helps me a lot for my life in U.S. later.
After coming to U.S., I have often got my mind boggled by various usages of English either in talks or in prints, which seem to be inconsistent with what I have learned before. In my guess, the reasons can be a combination of any of the following: 

what I have learned is probably
based on British English;
the usage by American is not always
rigorous, which sometimes put me
into the dilemma of which to follow;
I might need some excellent English
grammar books whose authors are
trustworthy experts who are also
native English speaker.

So, my question is, as for my last point, what are your recommendations for English grammar books? I would like to read comprehensive and nice-organized books from being concise, to being detailed. I think books for middle and elementary schools are perhaps not what I am looking for.
Thanks and regards!
",16984,What does “kind of edge” mean?,"From Steinbeck's Cannery Row,

If one of you fellas wants to kind of edge into my cellar without my wife seeing you, they’re on top of the side stringer on the left-hand side as you go in.

",97447,0
"""Smarter than me"" or ""smarter than I""?","
Possible Duplicates:
I can run faster than _____. (1) him (2) he?
“like I” or “like me”?

Which of these is correct and why?
I always assumed it followed the rule of ""which would be correct if you inserted the verb"", eg. Smarter than I am vs. Smarter than me am, in which case the former would obviously be correct.
But thinking more about it, I'm not sure...
",17083,Can English have words that are both alliterations and also rhyme?,"I’m wondering whether it’s possible for words to not only alliterate with each other but also rhyme with each other at the same time. Is it?
It seems like it should be possible, especially if you allow for a different number of syllables, but I can’t find any good examples. 
Is this actually possible in English?
",146495,0
"Pronouncing ""00's"" (as in 2000's)","
Possible Duplicate:
What is the name of the first decade in a century? 

When talking about decades in the 20th century, it is customary to refer to them using only the last two digits. For example, the 1990's are typically referred to by ""90's"", and so on.
As we move into the 21st century, I've noticed that similar conventions are being applied. The first decade has been called both ""2000's"" and ""00's"". However, while pronouncing something like ""90's"" is relatively simple, there is no clear way to pronounce ""00's"".
None of the possible pronunciations I've considered seem correct, so what is the right way to pronounce ""00's""?
",17119,Can a colon follow dependent clause?,"Two fires burning opposite each other: one that is kindled to acknowledge god’s grandeur and the other one that reminds us how insignificant everything else in life is; a subtle reminder of the dichotomy of life.
Here, can a dependent clause “Two fires burning opposite each other” be followed by a colon? If not, what punctuation mark should I use? 
Please correct.
",483020,0
who vs that as a pronoun,"
Possible Duplicate:
How to use: who/that 

I have seen many writers using ""that"" as a pronoun in cases where ""who"" should be used. For example, a book author says
I apologize to those of you that are unable to obtain electronic copies. 
Should it not be 
I apologize to those of you who are unable to obtain electronic copies. 
Or is it wrong to use the latter, in the modern context?
",17221,Did the CIA really introduce 'conspiracy theory' into popular usage after JFK?,"I heard that after the JFK assassination the CIA, through assets in mass media, introduced the term 'conspiracy theory', with it connotations of something clearly ridiculous, and only believed by maniacs, into common use. Before this it was used, but was a rare phrase, and had no idiomatic baggage.
If this is true, it's a really interesting conspiracy theory!
However, I can't find any hard evidence one way or the other...
",131702,0
"""BookList"" or ""booksList?""","
Possible Duplicates:
“User accounts” or “users account?”
Is it correct to say “lesson count” or “lessons count”? 

I'm wondering whether or not I should use a plural form noun with a collection name. For example, which one is correct, bookList or booksList (obviously they are variables in a programming language)?
",17329,"""From here, to there"" quote meaning","I read a story which used ""From here, to there"" as a love measurement. Does it mean distance or time period.
In the story ""From here"" was used when they where happy, with no worries in their life. As the story moved on they had complications, they lost trust for each other and they parted ways. After half a year the one who said ""From here"" was depressed and on the brick of no returning when she wrote ""To there"" to the other person.
What does this quote mean ?
",162871,0
"I often get confused by the usage of ""located "" and ""situated""","
Possible Duplicate:
Situated vs Located? 

Can I have a few examples to comprehend?
",17446,Is there a specific expression to denote territories which were once occupied?,"I have to write a long History essay about territories which were once occupied by one people, but no longer are. Is there a term for that, something like once-[insertpeoplehere]-occupied?
",524111,0
When do I use present perfect tense instead of the simple past?,"
I've finished my work.
  I finished my work.  

When do I use one or the other?
",17485,"Do people in Miami really talk like they do in the television series ""Dexter""?","as I'm far from being good English speaker, I use to watch series to improve my skills. I'm fan of various genres, from Star Trek to How I Met Your Mother and I can say until now, I felt ""aligned"" with it, meaning I knew why such and such grammar was used, when it was slang, shorter form etc.
Just recently I've picked up Dexter, nice one btw, and I can't stop wondering. People there (actors) speak completely different than what I was used to listen to. I don't mean accent or pronunciation (although I can see differences here, too) like in thread Why are movies so hard to understand (and what can you do about it)? but more like the actual (lack of) grammar.
For example, people many times skip words (""[are] You [willing to] be there?"" or ""See [you] tomorrow?"") and what was most surprising for me, they rarely use past and future tenses. So instead of let's say ""You have had a fight?"" actor just asks ""You fighting?"" or instead of ""Have you you told her that?"" just ""You tell her?"" or similar (yes, it's often combined with mentioned skipping of some words).
So my question is, is it really some kind of Miami slang (with influence of immigrants from Cuba who don't speak so well English) or it's just the series or it's just me being completely wrong?
",18304,0
What is the meaning of “till death do us part”?,"
Possible Duplicate:
“Till death do us part” 

It's a English name of a forthcoming Chinese film. The Chinese name is “Best love”.

",17616,"""Its"" or ""it’s"" in ""Getting Over It's IMPOSSIBLE PHYSICS!""","While browsing through YouTube, I came across a video titled 
“Getting Over It's IMPOSSIBLE PHYSICS!” which references to a new game titled 

“Getting Over It with Bennett Foddy”. 

My question is, is the use of the apostrophe in the video title correct? Should it be “Its” or “It’s” and why?
",425008,0
"Is it acceptable to drop the comma in ""Thanks, John""?","I grew up learning that the comma must be placed there, but it seems like an unnecessary interruption in a phrase that isn't ever spoken that way.
",17651,How come “enemy mine” be a short version of “the enemy of my enemy is my friend”?,"I have found at several places (e.g., here) that

Enemy mine

is a short version for the proverb:

The enemy of my enemy is my friend.

This makes little sense to me, as the essence of the proverb, i.e., the double enemy relationship, is lost in enemy mine.
My best guess so far is that this once was

Enemy of mine

and the double genetive (see, e.g., this question) really indicated a double dependence. But I am neither really happy with this nor can I confirm it.
",169122,0
"Using ""it's"" vs. using ""it is"" at the end of a sentence","
Possible Duplicate:
Is there some rule against ending a sentence with the contraction “it's”? 

Why is it that the following sounds incorrect:

""Would she know where it's?""

But this sounds fine:

""Would she know where it is?""

",17699,Question on law firm application,"
“We pride ourselves on being law, less ordinary. How are you less ordinary?”

I do not understand how the first sentence makes sense. Anyone care to explain? (Assuming it is not a typo.)
",188173,0
Is the following sentence grammatically correct? It doesn't sound right,"
Possible Duplicates:
“A total of 10 babies is sleeping.” v.s. “A total of 10 babies are sleeping.” v.s. “Ten babies in total are sleeping.”
Is “a total of 10 payments” singular or plural? 


A total of 315 questionnaires was received from your area, and in particular the response to Question 10 was most positive.

Was / Were ?
",17821,what DID I just see?,"I always thought we should use present perfect tense while using the word ""just"". But recently I have come across people commenting, ""What did I just see?"" or, ""What did I just watch?"" 
Being a student learning English and its grammar, when I saw those I was like, ""What have I learned so far?"" lol. English grammar seems to be changing always but but I want to be very fluent in it. Help me people. 
",277472,0
What does 'it' refer to in this example?,"
Possible Duplicate:
It's raining. What is? 

'It is raining.'
What does 'it' refer to?
I know some people might say 'the weather' but you wouldn't say: 'The weather is raining.'
But you would say: How's the weather? It's raining.'
Bit confusing. 
",17992,when or from where,"The figure rose until 2012 when it experienced a significant fall.
The figure rose until 2012 from where it experienced a significant fall.
Which is correct?
",382411,0
"""Did you find"" versus ""have you found""","What is the difference between ""Did you find?"" and ""Have you found?""
When should I use the first sentence, and when the second one?
",18107,"When 'willing' is added, does this intensify or weaken the meaning of “I bet”?","
Although I could not see it in the fog, I knew that Gibbet Wood lay
  not far ahead at the top of Gibbet Hill. It would be wet and soggy in
  among the trees, but I was willing to bet that the police had not been
  there before me. (from The Weed that Strings the Hangman’s Bag)

Oxford says ‘I bet’ is ‘used to express certainty.’ If the word ‘willing’ (Oxford says; ready, eager, or prepared to do something) is added like the example, does it intensify or weaken the meaning of “I bet”?
",102259,0
"Difference between ""in"" and ""into""","
Possible Duplicate:
When should “into” be used rather than “in to,” and vice versa? 

I often get confused about which one to use: in or into? Kindly tell me what the difference is between the two.
",18144,"I need a word in English that means ""from complexity to singularity"" or ""from complexity to simplicity""?","I'm looking for either a word or a phrase meaning ""from many to one"" or ""from complexity to singularity"".
",366331,0
How do I handle articles with parenthetical statements?,"
Possible Duplicate:
“a/an” preceding a parenthetical statement

If I were to use a (normal) parenthetical statement, the article would not cause problems. If I were to use a (unusual) parenthetical statement, the article seems incorrect.
How should I proceed? Is one of these options correct:

This is a (unusual) statement
This is an (unusual) statement
This is a(n unusual) statement

The last seems most appropriate to me but I suspect that is due to me and not the appropriateness of the sentence.
",18378,Use of until/till,"I usually get confused while using those words.......
For example: ""The producers already confirmed that Bran Stark and his associated storyline will not reappear until Season 6.""
Here,will Bran Stark come in season 6 or after season 6?
",240400,0
Are there other repeated single word sentences like the Buffalo sentence?,"
Possible Duplicate:
Awkward sounding but grammatically correct sentences? 

My friend told me about the Buffalo sentence:

Buffalo buffalo Buffalo buffalo
  buffalo buffalo Buffalo buffalo. 

It is a grammatically valid sentence in the English language, used as an example of how homonyms and homophones can be used to create complicated linguistic constructs.
I was wondering if there are other examples of this type of sentence?
",18556,"What does the phrase ""There's a little bit of an edge"" mean?","I'm listening to this podcast and I hear the following phrase at around 13:45.  

There's a little bit of an edge to work in a company where you make
  games.

I can guess only guess it means: It is a priviledge or something like that. I've searched the phrase in google but didn't find anything. Could anyone please elaborate on the actual meaning of this phrase?
",231439,0
"""It isn't"" versus ""it's not""","
Possible Duplicate:
“It isn't” versus “it's not” 

Is there any difference in meaning, or supposed impression when hearing it? 
",18602,What is the opposite of 'cozy'?,"I'm trying to find a word to describe a restaurant space that is the opposite of cozy. The only word I can think of is cavernous, however I don't wish to give the sense that the space is particularly large. It's simply that it is not cozy.
",64459,0
Should one use 'a' or 'an' when the following word is in parentheses?,"
Possible Duplicate:
“a/an” preceding a parenthetical statement 

This question is a little hard to summarize in the title.
I sometimes like to use parentheses to add additional (but nonessential) details to a sentence - like I did just there. My criteria for such use is usually that the sentence could be read with the text in the parentheses, or excluding the text, and each would be an equally valid and grammatically correct statement.
So I am curious: in a case where the parenthesis is preceded by the word 'a', and the word in parenthesis begins with a vowel (or unsounded h) that would require it to be changed to 'an', what is the correct statement?

In addition to these three journal articles containing background information, I have included a (anecdotal) reference describing this proposed cure.
In addition to these three journal articles containing background information, I have included an (anecdotal) reference describing this proposed cure.

I feel as though if I use the word 'an' it draws too much attention to the word anectodal, and I might as well just remove the parentheses. I'm just trying to slip the word in there to cover my ass if someone says ""That's not a valid reference - it's just an anectote."" If you are curious about the context: the anecdotal reference is included because it describes the process in greater detail than is captured by my summary.
Feel free to comment on the validity of my use of parentheses while you're at it.
",18631,"In this sentence, should ""in"" or ""at"" be used before ""colleges"", ""parties"", and ""family reunions""?","
She talked about shoes all the time: [...] college, [...] parties, and
  even [...] family reunions.

Which one should I use in the sentence above? (should I also include while?)
",156404,0
"Pronunciation of ""the""","
Possible Duplicate:
What is the pronunciation of “the”? 

I've noticed that the word the is not always pronounced in the same way depending on the sound of the next word. I think it may be like the word a/an:

an for words starting with a vowel sound: e.g. owl, honest person
a for words starting with a consonant sound: e.g. dog, user

Is there any rule for this? What would be the exact sound for each case (please give a similar word with the same sound to have an idea)?
",18739,"The ""wrought /wreaked havoc"" misunderstanding","According to the American Heritage Dictionary:


the past tense and past participle of the verb  to wreak is wreaked, not wrought, which is an alternative past tense and past participle of work.


In the  expression to wreak havoc ,  which means: 


to cause a lot of trouble or damage as in:  strikes have wreaked havoc on local businesses. (TFD)


wrought   has been used for decades before the alternative version with wreaked appeared as shown in  Ngram.
According to the Collins Dictionary:


wrought is sometimes used as if it were the past tense and past participle of wreak as in the hurricane wrought havoc in coastal areas. Many people think this use is incorrect. 


But according to the Oxford Learner's Dictionary the usage in the past tense of wrought (an archaic past tense of work) is idiomatic: 


wrought something (formal or literary) (used only in the past tense) caused something to happen, especially a change: 

This century wrought major changes in our society.
The storm wrought havoc in the south.



Questions: 
1)Isn't ""wrought"" in ""wrought havoc"" just misunderstood as the wrong past tense of ""wreak""? 
2) Isn't   ""wrought havoc"", as a consequence, grammatically and idiomatically correct as ""wreaked havoc"" is? 
in other words, what happened to ""wrought and wreaked""? Why do lexicographers think that people misunderstand their usage? 
",304867,0
