q1_title,q1_body,q1_id,q2_title,q2_body,q2_id,duplicate_label
Is it ever acceptable for a period to come after a quote at the end of a sentence?,"
Possible Duplicate:
Is it correct to use “punctuation outside of the quotations”, or “inside?” 

I've heard that you should always place ending punctuation inside of quotes, no matter what.  
Are there any cases where it is appropriate for a sentence to end with "".?
",23,"Is it correct to use ""punctuation outside of the quotations"", or ""inside?""","
Possible Duplicate:
How should I punctuate around quotes?
When should end punctuation go inside quotes? 

Or is it region specific? I was always taught that when ending a quotation, that punctuation remains inside of the quote.

I think he said, ""we should go to the store.""
  Are you sure he said, ""we should go to the store?""

As opposed to:

I think he said, ""we should go to the store"". Are you sure he said, ""we should go to the store""?

This is just an arbitrary example off of the top of my head, and it's hard for me to come up with an example for the second usage because it looks completely wrong to me. 
I actually got into a small argument with my girlfriend earlier this year because she uses something similar to the second example, and said that's how she was taught (which is why I ask if it's region-specific.)
Anyway, is there a correct usage for ending a quotation with punctuation?
",5490,1
"When referring to a noun, when does the gender matter?","In most languages, gender plays a much more important role than in English. Nevertheless, it is possible to refer to a noun using its gender.

The ship was launched on 4 October 1853. Tayleur left Liverpool on 19 January 1854, on her maiden voyage.

How does one know that ""ship"" is feminine? Are there masculine nouns?
",118,Pronoun question: referring to inanimate objects as 'he' or 'she',"I read the following claim concerning pronouns referring to inanimate objects: 

Anything that is meant to contain you, protect you or provide you with something beneficial is [often referred to as] a she; anything that is a perceived threat is a he. That's why cars, boats and some countries are she.


Is this really the case, or is it just a subjective claim? (According to the Chicago Manual of Style using he/she for inanimate objects is not recommended and it should be used instead.)
Is there a 'rule' for determining whether to use he, she or it based on the impression one would like to express? (I only know the 'rule' for animals: In the case where you know their gender and they are important to you, you refer to them using he/she. E.g. A dog attacked me in the street. It bit me. versus This is my dog Roger. He is 7 years old.)
Have these practices changed over time?

Note 1: There is already a similar question (Referring to objects as ""she""), but that considers only the feminine case and none of the answers offers an objective discussion of the matter.
Note 2: My native language is Czech, where the gender of the pronoun is based only on the grammatical gender of the noun. E.g. a cat (kočka) is always she, a dog (pes) is always he, a boat (loď) is always she and a car (auto) is always it.
",287721,1
"Contemporary written usage of ""whom"" in objective case","
Possible Duplicate:
What's the rule for using “who” or “whom”? 

I was writing a LinkedIn recommendation one day, and ended up pondering for a while which of these forms to use:

… is a great developer whom I always
  found easy to work with.
… is a great developer who I always
  found easy to work with.

Both are basically correct in contemporary English, right? But is one or the other preferable, and if so, why? 
(In this case I went with the latter, as it seemed more common (Google)  and I wanted to avoid sounding unnecessarily “archaic”, although I’m not sure whether that would have been the case. Also note that I try to write in a “friendly professional” style instead of overly formal one. :-)
",331,What’s the rule for using “who” and “whom” correctly?,"I can never figure out whether I should use who and whom. Most people use who for both colloquially, but some people say this is not correct.
What’s the rule for using who and whom correctly?
",56,1
"What can I use to remember the difference between ""well"" and ""good""?","
Possible Duplicate:
What is the difference between “good” and “well” 

Okay, I actually have no idea when it's okay to say well or good but once again I vaguely remember a rule about them and I don't want to sound ignorant anymore or have that memory haunt me whenever people ask me how I'm doing.
",665,"What is the difference between ""good"" and ""well""","Most of the time, I use good and well interchangeably. However, on many occasions I would find well or good a misfit. Please suggest the proper usage. 
",5174,1
"What does Maugham mean by ""his spaghetti were""?","
Possible Duplicate:
Was the usage ""Spaghetti were"" ever acceptable or common? 

[Following up from, but not a duplicate of, this question by another user, which was unresolved…]
Somerset Maugham's The Moon and Sixpence contains an unusual (perhaps even unique) usage of English that I'm hoping some native speaker can shed light on. Here is the sentence in bold, with some surrounding sentences for context. Dirk Stroeve has previously been described as ""a painter, but a very bad one"". The narrator says:

In the evenings I went to see my
  friends.  I looked in often on the
  Stroeves, and sometimes shared their
  modest fare.  Dirk Stroeve flattered
  himself on his skill in cooking
  Italian dishes, and I confess that
  his spaghetti were very much
  better than his pictures.  It was a
  dinner for a King when he brought in a
  huge dish of it, succulent with
  tomatoes, and we ate it together with
  the good household bread and a bottle
  of red wine.  I grew more intimate
  with Blanche Stroeve…

Since spaghetti is (almost?) always used in English in the singular as an uncountable (mass) noun, this is unusual. What is the right interpretation of this sentence?

""His spaghetti"" is parallel to ""his omelettes"". That is, it refers to the many occasions he cooked spaghetti, and means something like ""his spaghetti dishes were better than his pictures"". (The OED entry for 'spaghetti' has ""1. a. A variety of pasta made in long thin strings. Occas., a dish of spaghetti."")
As in the original Italian usage, ""spaghetti"" in the plural here refers to multiple strands of spaghetti or pieces of spaghetti.
Something else.

(I am partial to (1.) myself, but this interpretation was described by another user as ""unlikely"" and ""completely absurd"", so I'm trying to know for sure.)
",861,"Was the usage ""Spaghetti were"" ever acceptable or common?","In W. Somerset Maugham's The Moon and Sixpence, there is a line about Dirk Stroeve which goes His spaghetti were …. Spaghetti is plural in Italian, but is this ever a normal usage in English? Spaghetti seems to be entrenched as an uncountable (mass) noun these days. 
",170,1
"""a"" or ""an"" for words that don't start with vowels but sound like they're starting with a vowel","Is it correct to say or write an student or an store?
",1019,"When should I use ""a"" vs ""an""?","In the following example, is it appropriate to use a or an as the indefinite article, and why?

He ate __ green apple.

I know that in the case of just ""apple"", it would be ""an apple,"" but I've heard conflicting answers for ""green apple,"" where the noun is separated from the article by an adjective.
Also, which is more appropriate in this case:

He ate  __ enormous Pop-Tart.

",152,1
"Is there any difference between ""talk to someone"" and ""talk with someone""?","
Possible Duplicate:
“Speak to” vs. “Speak with” 

Well, the question is in the title. I always had the impression that ""talk to someone"" refers to situations when some information must be conveyed to someone else, while ""talk with someone"" refers to cases that involve a more complex two-sided interaction. E.g., I ""talk to my colleague"" to tell him that I'm going for a lunch break (no response is required apart from maybe an acknowledgment), while I go and ""talk with my colleague"" if I have to discuss something with him in detail. Is this correct, or is there any difference between the two phrases, or is there no difference at all?
",1029,"""Speak to"" vs. ""Speak with""","What are the differences between these two phrasal verbs and what are the best situations to use each?
",866,1
Each apple and each orange [has/have]?,"For a phrase such as the following: 

each apple and each orange

Is it correct to use ""has"" or ""have"" when describing properties of both apples and oranges?
",1472,"Why is ""each row and each column"" followed by a singular verb in this sentence?","I am reading a book that contains the following text. 

A square matrix P is said to be a permutation matrix if each row and each column of P contains a single element 1, and the remaining elements are zero.

My questions are:  

why is ""contains"" used? why not ""contain""? Since there is a ""and"" before ""contains"".  
why not ""zeros"" for the last word in the sentence?

",380700,1
Is it normal to separate hyphenated words on different lines?,"I'm typing in Microsoft Word, and it automatically separated the word T-shirt when it ran out of room:

blah blah blah, Lorem ipsum dolor sit amet, I have a T-
  shirt

leaving just the letter ""T"" on one line.  This doesn't look right to me at all, or for any compound, hyphenated word, yet basically all text boxes will split words at a dash on separate lines if needed.  I would prefer:

I have a
  T-shirt

I know it would be fine if I were splitting words in a narrow column, like the newspaper, but is there a rule about what you're supposed to do to words like this?  Is my way always right, or Word's, or either?  (How to get Word to actually stop doing it is a totally different question...)
",1688,What are the rules for splitting words at the end of a line?,"What are the rules in English language to split words at the end of a line? 
Where exactly must the hyphen split the word?
",385,1
Which preposition should be used after the verb “request”?,"Which is correct?

I would like to request you to refrain from shouting.
I would like to request of you to refrain from shouting.
I would like to request from you to refrain from shouting.
Something else?

",2183,"Is it correct to say ""I kindly request you to...""?","Isn't kindness already implied when you say ""I request you to...""?
When I say ""I humbly request you to..."", the word humbly helps me to label the state of my behavior during the request.
On the other hand, what value does the word kindly add to the request?
",96162,1
"Are double negatives proper English (e.g. ""I don't know nothing"")?","I have heard many (rather most) people, especially in the USA, saying: 

I don't know nothing about it.

Is that correct? I always get a weird feeling hearing this and feel the correct one would be saying:

I don't know anything about it.

",2232,Origin and correctness of “ain’t no”?,"In contemporary American English usage, I come across sentences like:


I ain’t got no money.

Ain’t no man like him.



Saying ain’t no sounds incorrect to me because it is a double negative.  What is the origin of this particular construction?
I wasn’t able to find anything online related to the origins of this incorrect usage.
",113541,1
What to use - 'I' or 'Me'?,"
Possible Duplicates:
Which is correct, “you and I” or “you and me”?
When do I use “I” instead of “me?” 

Which one of the following sentences is correct?

John and me are working on it.

or

John and I are working on it.

",2234,"Which is correct, ""you and I"" or ""you and me""?","When the phrase is used as an object, why so many native speakers are saying ""you and I"" instead of ""you and me""? I'm not a native speaker but I thought ""you and me"" is correct. Not sure if this falls into the same category, but ""Just between you and me"" sounds more natural than ""Just between you and I"".
",1047,1
Using Multiple Sentence Stoppers?,"
Possible Duplicate:
Is there a standard ordering for the question mark and the exclamation mark used together?

When writing an exclamation-question like:

What you you mean, I'm fired
Don't you think you've done ENOUGH today

Should you end the sentence with ?!, !? or just !
What's grammatically correct?
What's acceptable for casual usage (where grammar is less important)?
Is it just preference?
WHAT'S THE ANSWER?! <-- my preference
",2423,Is there a standard ordering for the question mark and the exclamation mark used together?,"We've all wanted to express certain questions, rhetorical or not, with annoyance, excitement, surprise, frustration and so on. What better way than with both a question mark (?) and an exclamation mark (!), right?
I've seen two ways of punctuating such questions:

Where is this place?!


Who do you think you are!?

(Things like ?!?, !?!, ?????!!!!!, ??!?!!?!?!!??, etc are irrelevant here.)
Which is the proper way to order the two symbols? Or does each of the above two have a distinct and grammatically correct meaning?
Or is the interrobang (‽) the clear winner here? ;)
",531,1
How Would One Use A Semicolon (;)?,"
Possible Duplicate:
How does one correctly use a semicolon? 

I'm wondering about the difference between just ending the sentence and starting a new one based on the same subject and using a semicolon to branch the two sentences together.
Can anyone help me on this one?
",2466,How does one correctly use a semicolon?,"How does one correctly use a semicolon?  It is probably one of the more difficult punctuation marks to master in my opinion.
",92,1
"""Everyone"" or ""everybody""","Are the words everybody and everyone interchangeable?
",2608,"Choosing between ""everybody"" and ""everyone""","When addressing a radio audience, is welcome everybody the appropriate word choice? Why not welcome everyone?
",46381,1
"Which is correct: ""what if there was"" or ""what if there were""?","
Possible Duplicate:
“If I was” or “If I were”. Which is more common, and which is correct? 

Is this correct grammar?

What if there was a Stack Overflow on… 

Shouldn't it be ""what if there were a Stack Overflow on…""?
",2705,"When to use ""If I was"" vs. ""If I were""?","
If I was...
If I were...

When is it correct to use ""If I was"" vs. ""If I were"" in standard English?
",660,1
an SQA or a SQA?,"
Possible Duplicate:
Do you use “a” or “an” before acronyms? 

Although I am clear about the usage of 'an' and 'a' on most cases, but I am not sure how they are applied in front abbreviations. I heard that, whether vowel or consonants, abbreviations are always used with the 'an' article. 
Can someone confirm this?
",2736,"Do you use ""a"" or ""an"" before acronyms / initialisms?","99% of the time, I'm clear on when I should use ""a"" versus ""an."" There's one case, though, where people & references I respect disagree.
Which of the following would you precede with ""a"" or ""an,"" and why?

FAQ
FUBAR
SCUBA

[Note: I've read the questions ""A historic..."" or ""An historic…""? and Use of ""a"" versus ""an"", but the rules given there don't necessarily apply here.]

[Edited to add]
Here's a shorter (and hopefully clearer) version of the question…  In written English, which is correct (and why): ""a FAQ"" or ""an FAQ""?
Some references with differing opinions:

an: the UC San Diego Editorial Style Guide and Apple Publications Style Guide
a: the Microsoft Manual of Style for Tech Publications, 3e
either: the alt.usage.english FAQ and Yahoo! Style Guide

",1016,1
Is using i instead of I for first person singular really bad?,"
Possible Duplicate:
Is it ok to use “i” in lowercase or should you always use “I” (uppercase)? 

Is using i instead of I for first person singular noticed as a bad syntax error or is it acceptable?
",2847,"Is it alright to use lowercase ""i"" or should you always use ""I"" (uppercase)?","I frequently edit questions on StackOverflow, and I always fix the ""i"" into ""I"".
See this edit revision for instance.

When i I start my tomcat, i I am getting this problem.
  How could i I resolve this problem.

Am I right to do so?

Benjol points out an interesting thread illustrating that debate: 

the MetaSO question ""Can users please refrain from making minor edits to a question I post?"" (and its edits):


The point of text on a site like this is to communicate.
  Why do you want  to make it harder to communicate than it has to be?
  You may like writing with no capitalization, but I think it's pretty clear that people prefer reading with capitalization.
  If you don't care about making life easier for those trying to help you, why do you think anyone will bother helping you in the first place?


The article ""Capitalize, please"" also refers to norms.


Readers of the modern English language have grown accustomed to certain norms. Paragraphs, for one. Punctuation. Consistent spelling. And, of course, capitalization. 

",172,1
"""I have"" = ""I've"". Is that always correct?","
Duplicate:
Is it appropriate to use short form of “have” ('ve) when it means possession? 

I feel uncomfortable saying sentences like the following: 

""I've a car"" instead of ""I have a car""
""He's a pen"" instead of ""He has a pen""
etc

I ask this because I read something like that in a book.
Are they correct? and what is the rule?
",3004,"Is it appropriate to use short form of ""have"" ('ve) when it means possession?","I feel uncomfortable saying sentences like the following: 

""I've a car"" instead of ""I have a car""
""They've a great time"" instead of ""They have a great time""
""He's a pen"" instead of ""He has a pen""
etc

I ask this because I read this sort of thing in a book.
Are they correct? And what is the rule? Can you use such forms in a formal setting?
",8,1
"Referring to objects as ""she""","Sometimes people are referring to mechanical objects as ""she"":

I love my car. She always gets the best service.

Are there any rules when it is appropriate to use ""she"" instead of it, and is ""he"" ever used in such context?
",3178,Pronoun question: referring to inanimate objects as 'he' or 'she',"I read the following claim concerning pronouns referring to inanimate objects: 

Anything that is meant to contain you, protect you or provide you with something beneficial is [often referred to as] a she; anything that is a perceived threat is a he. That's why cars, boats and some countries are she.


Is this really the case, or is it just a subjective claim? (According to the Chicago Manual of Style using he/she for inanimate objects is not recommended and it should be used instead.)
Is there a 'rule' for determining whether to use he, she or it based on the impression one would like to express? (I only know the 'rule' for animals: In the case where you know their gender and they are important to you, you refer to them using he/she. E.g. A dog attacked me in the street. It bit me. versus This is my dog Roger. He is 7 years old.)
Have these practices changed over time?

Note 1: There is already a similar question (Referring to objects as ""she""), but that considers only the feminine case and none of the answers offers an objective discussion of the matter.
Note 2: My native language is Czech, where the gender of the pronoun is based only on the grammatical gender of the noun. E.g. a cat (kočka) is always she, a dog (pes) is always he, a boat (loď) is always she and a car (auto) is always it.
",287721,1
"""I'm sure I can do it"" or ""I'm sure THAT I can do it""?","
Possible Duplicate:
Use of “that” in a sentence 

It's all in the title. Should I use ""that"" as a connector, or should I refrain from using it ?
",3215,"Are there rules about using ""that"" to join two clauses?","
He will understand that I was not joking.


He will understand I was not joking.

Which of the sentences is correct? Are there any specific rules about the use of ""that"" in the sentences I reported as example?
",1095,1
Plural of an initialism that ends with the letter S,"
Possible Duplicate:
What is the correct way to pluralize an acronym? 

I was answering something on Super User and wrote OSes as part of my normal flow without really thinking about it. On a re-read I decided that it didn't look right, so I changed it to OSs, which still felt incorrect. I also considered OS's, but that didn't feel right either, so I thought I'd ask on here.
In this specific case, what is the written plural form for OS?
The intention is to mean multiple Operating Systems.
And, is there a general rule for the plural form of an initialism that ends with the letter S?
",3348,What is the correct way to pluralize an acronym / initialism?,"For example, if I wanted to write the equivalent of

There are many automated teller machines in this city.

Would it be

There are many ATMs in this city.

or

There are many ATM's in this city.
(could get confused with possessive form or contraction).

or just

There are many ATM in this city.
(assuming the final s is included in Machines represented by M).

Maybe something else?
",503,1
Plural for decimals?,"
Possible Duplicate:
0.25 mile or 0.25 miles? 

When writing out a quantity and then a noun what is the correct form for decimals?
1 day
2 days
.5 days?

It seems that if you were to say ""half day"" then the singular is reasonable but if you were to day ""point five days"" that also seems correct.  
",3400,Should we use plural or singular for a fraction of a mile?,"I have seen people say both 0.25 mile and 0.25 miles. Should we use plural or singular for a fraction of a mile?
",2139,1
"Should ""none"" as a pronoun be used as singular or plural?","
Possible Duplicate:
None as plural indefinite pronoun 

I was programming when it suddenly struck me that I did not know if ""none"" should be singular or plural.
Fore instance, should I write ""none is yellow"", or ""none are yellow"", if I know nothing more about what ""none"" refers to?
In this related question, it came out that in many instances ""none"" as a plural indefinite pronoun is completely acceptable. However, that didn't really teach me when to use it as singular or plural.
",3485,"""None"" as plural indefinite pronoun","In my grammar book (English Grammar, HarperCollins Publishers), I read that none is occasionally treated as plural, but it is usually regarded as singular. Can you give me an example of sentence where none is used as plural pronoun?
",1425,1
A/An question: 'a humanitarian' or 'an humanitarian'?,"
Possible Duplicate:
When should I use “a” versus “an” in front of a word beginning with the letter h? 

What's the proper wording here, neither one sounds right to me:

""Chevra, an humanitarian
  organization...""

or

""Chevra, a humanitarian
  organization...""

My instinct says it follows the same rule as ""an hour"", but the 'h' sound is more pronounced in 'humanitarian', so I'm unsure.
",3762,"When should I use ""a"" versus ""an"" in front of a word beginning with the letter h?","A basic grammar rule is to use an instead of a before a vowel sound. Given that historic is not pronounced with a silent h, I use “a historic”. Is this correct? What about heroic? Should be “It was a heroic act” or “It was an heroic act”?
I remember reading somewhere that the h is sometimes silent, in which case it’s an, and when the h is pronounced, it’s a. But then I also remember reading that it depends on which syllable is stressed. And I also think I read somewhere that it might differ between British and American English.
Personally, I pronounce the h, and believe that a is correct. I find that it sounds incorrect to use an and pronounce heroic without the h.
So how do I know when to use a and when to use an with a word beginning with the letter h? Are both acceptable or is there one that is correct?
",629,1
